<?xml version="1.0" encoding="UTF-8"?>

<args
        xmlns:xsi="http://www.w3.org/2001/XMLSchema-instance"
        xsi:noNamespaceSchemaLocation="args.xsd">

    <command>
        <name>check</name>
        <help>No help for you</help>
    </command>

    <arg>
        <name>--chapter</name>
        <name>-c</name>
        <param name="chapter number" type="1-18|all" />
    </arg>

    <help>BJP3 Checker &#169; Liam Bloom 2021</help>
</args>